bid,spam,contents
17107156,1,E thích thì cứ lây đi ngại gì Trang Nguyen
17107157,1,E thích hạt ở giưã Kiên ManUtd
17106438,0,SMH??i dove all this way to work and i left my focus at home... its monday... its chest day... and its the day after drill.. ADHD will be at a all time high today.. and im OK with that. bout to research some chest workout till im able to focus again. ??dont judge me... spot me...
17105970,1,"From the books of Dialogues by Saint Gregory the Great, pope?(Lib. 2, 33: PL 66, 194-196)??She who loved more could do more??Scholastica, the sister of Saint Benedict, had been consecrated to God from her earliest years. She was accustomed to visiting her brother once a year. He would come down to meet her at a place on the monastery property, not far outside the gate.??One day she came as usual and her saintly brother went with some of his disciples; they spent the whole day praising God and talking of sacred things. As night fell they had supper together.??Their spiritual conversation went on and the hour grew late. The holy nun said to her brother: “Please do not leave me tonight; let us go on until morning talking about the delights of the spiritual life.” “Sister,” he replied, “what are you saying? I simply cannot stay outside my cell.”??When she heard her brother refuse her request, the holy woman joined her hands on the table, laid her head on them and began to pray. As she raised her head from the table, there were such brilliant flashes of lightning, such great peals of thunder and such a heavy downpour of rain that neither Benedict nor his brethren could stir across the threshold of the place where they had been seated. Sadly he began to complain: “May God forgive you, sister. What have you done?” “Well,” she answered, “I asked you and you would not listen; so I asked my God and he did listen. So now go off, if you can, leave me and return to your monastery.”??Reluctant as he was to stay of his own will, he remained against his will. So it came about that they stayed awake the whole night, engrossed in their conversation about the spiritual life.??It is not surprising that she was more effective than he, since as John says, God is love, it was absolutely right that she could do more, as she loved more.??Three days later, Benedict was in his cell. Looking up to the sky, he saw his sister’s soul leave her body in the form of a dove, and fly up to the secret places of heaven. Rejoicing in her great glory, he thanked almighty God with hymns and words of praise. He then sent his brethren to bring her body to the monastery and lay it in the tomb he had prepared for himself.??Their minds had always been united in God; their bodies were to share a common grave.??#catholic #christian #jesus #spirituality #spiritualrenewal #praise #worship #artistoftheday #emi #worshipsongs #bible #tbn #trinitybrodcastingnetwork #thechurchchannel #ocp #christianmusic #christianradio #church #pastor #monk #christ #gospelmusic #liturgy #mass #catholicism #eucharist #theology #virginmary #popefrancis #saints"
17105950,1,"February 10: 20 degrees Aquarius; Mercury decan- Aquarius/ Gemini.??Feast Day: Anahita’s Day.??Sabian Oracle: “A large white dove bearing a message.”??Constellation: Cetus; keyword- “Repression.”??The Star trump continues in play as the card associated with the zodiac month of Aquarius as does the King of Cups which covers the calendar month of February.  The Seven  of Swords enters play at 20 degrees to 30 degrees Aquarius, along with the constellation Cetus.<br /><a href=""http://www.facebook.com/photo.php?fbid=554364331325432&set=pcb.554365821325283&type=1&relevant_count=9""></a><br />"
17105947,1,"Today the Church celebrates the feast of Saint Scholastica, virgin.??Saint Scholastica and her twin brother, Saint Benedict, were born in Umbria, Italy around the year 480. She was inspired by her brother's teachings and his monastic way of life. She dedicated her life to serving God and she founded the Order of Benedictine nuns following the Rule of Saint Benedict. She died in the year 574 and her soul was said to have ascended to heaven in the form of a dove. She is invoked as the patron saint against stoms and bad weather."
17107150,1,ถูกต้องแล้วค่ะ
17105851,1,"TO THE DEAREST HEART.....??Who is this coming frm d desert,arm in arm with her lover??Under the apple tree i woke u,in d place where u were born.??Close your heart to every love but mine; hold no one in your arms but me.??Love is as powerful as death;?Passion is as strong as death itself.?It bursts into flame and burns like a raging fire.??Water cannot put it out;?No flood can drown it.?But if anyone tried to buy love with wealth,contempt is all they would get.??Like an apple tree among d trees of d forest,so is my dearest compared with other ladies.??I love to sit in her shadow and her fruit is sweet to my taste.He brought me to his banquetting hall and raised his banner of love over me.??You are like a dove that hides?In d crevice of a rock.?Let me see your lovely face?And hear your enchanting voice.??To the one that matters most......"
17105850,1,"Matthew 3:13-17?Then Jesus came to Galilee to the Jordan to be baptized by John. But John tried to deter him, saying ""I need to need to be baptized by you, and do you come to me?"" Jesus replied, ""Let it be so now; it is proper for us do this to fulfill all righteousness."" Then John consented. As soon as Jesus was baptized, he went up out of the water. At that moment heaven was opened, and he saw the Spirit of God descending like a dove and lighting on him. And a voice from heaven said, ""This is my Son,  whom I love; with him I am well pleased."""
17105814,1,"pure breed lab ! very young, named Millie . She needs pledges and a rescue or an adoption.?good with other dogs and children!!!??Isabella Labrador Issy, Huskyn Lab Rescue Inc., Mutt and Lab Rescue, Lenore Loves-labdanes, Michelle LabLvr West, Tracy Lab Crossposter, Labs NeedingRescue, Labs4rescue, American Lab Rescue, Save A Lab, Moore Labs Rescue, Labrador Friends of the South, Inc., Laurie Wilder Lawrence, Cave Canem, Sally Hunter Garshell, Tracy Gunnels Crossposter, April Caldwell Free, April Dove, Quincey Simmons, Shannon Prouty, Shannon Thomas Crossposter, Brenda Solis Crossposter, Shannon Crudele, Lucky Labs Rescue, Lucky Lab Rescue and Adoption??wonderful young pure breed labbie girl. she needs pledges and a rescue/ adoption<br /><a href=""http://www.facebook.com/photo.php?fbid=494519163992797&set=a.421675401277174.1073741840.345448152233233&type=1"">CODE RED NOW</a><br />KENNEL 4 FEMALE LAB.  OWNER SURRENDER, AVAILABLE NOW. This girl's name is now Millie.  ??SEE THE RESCUE PROCESS UNDER THIS INFO:  This sweet dog was brought in by a woman who quickly filled out the paperwork and walked out of the office before we got back from putting Millie in a kennel.  Millie is young and very friendly, but I could see her looking for her owner, and she cried when she heard the minivan drive away.  She is a great dog with a typical labbie personality, and she loves other dogs and children.  Please help her! ??TO RESCUE OR ADOPT THIS OR ANY OF OUR ANIMALS, YOU MUST:??1. SEND AN EMAIL WITH YOUR NAME, ADDRESS AND VET REFERENCE TO COLUMBUSCOUNTYDOGS@GMAIL.COM and JULIEZDOGS@GMAIL.COM.??2. PAYPAL THE PULL FEE ($10 FOR 501 RESCUES, $25 FOR ALL OTHERS) AND KENNEL NUMBER TO JULIEZDOGS@GMAIL.COM.??3. IF YOU CANNOT PICK UP THE ANIMAL YOURSELF, CALL SOUTH ROBESON VET AT 910-628-7178 TO HAVE THE ANIMAL PICKED UP, VETTED AND BOARDED TO RECEIVE A HEALTH CERTIFICATE. PLEASE NOTE that only nonprofit rescues are able to collect pledges; adopters and private rescues must pay all costs.??4. ARRANGE FOR PROFESSIONAL TRANSPORT TO YOU.??These companions are at :?Columbus County Animal Shelter?288 Legion Dr Whiteville, NC 28472?Their hours are Mon- Fri 12-4 — at Columbus County Animal Control.<br />CODE RED ANIMALS - These dogs are in danger as soon as they are available because this small shelter is normally full to capacity. They need pledges for approved rescues and shares for help. Approved 501c3 rescues may collect pledges to offset cost; adopters and all others must be prepared to pay for all vetting, boarding, and transport expenses. Please email Columbuscountydogs@gmail.com with any offers or serious questions. Thank you!"
17105762,1,1 https://www.facebook.com/pages/Tu-sei-mio/688738927824876?2 https://www.facebook.com/pages/Siamo-naufraghi-vivi-in-un-mare-damore/459890770762897?3 https://www.facebook.com/pages/Ciicci%D0%B8%CE%B1-/484884804930084?4 https://www.facebook.com/Sorridicheseibellissima177658745773441?5 https://www.facebook.com/sonounasognatrice?ref=hl?6 https://www.facebook.com/pages/un-attimo-di-pace/156008974473916?7 https://www.facebook.com/pages/Eri-tutto-m%CE%B1-tutto-p%CE%B1ss%CE%B1-/1401422316763410?8 https://www.facebook.com/pages/L%CE%B1micizi%CE%B1-rip%CE%B1r%CE%B1-dove-l%CE%B1more-distrugge/214493165414881?9 https://www.facebook.com/pages/I-999-messaggi-pi%C3%B9-divertenti/281623865325110?10 https://www.facebook.com/pages/No-vaffanculo-Hai-spezzato-il-mio-cuore/225257224258880?11 https://www.facebook.com/Milvettapuo?12 https://www.facebook.com/pages/Ti-Amo-e-Ti-Penso/100640733447049
17105735,1,"TO THE DEAREST HEART.....??Who is this coming frm d desert,arm in arm with her lover??Under the apple tree i woke u,in d place where u were born.??Close your heart to every love but mine; hold no one in your arms but me.??Love is as powerful as death;?Passion is as strong as death itself.?It bursts into flame and burns like a raging fire.??Water cannot put it out;?No flood can drown it.?But if anyone tried to buy love with wealth,contempt is all they would get.??Like an apple tree among d trees of d forest,so is my dearest compared with other ladies.??I love to sit in her shadow and her fruit is sweet to my taste.He brought me to his banquetting hall and raised his banner of love over me.??You are like a dove that hides?In d crevice of a rock.?Let me see your lovely face?And hear your enchanting voice.??To the one that matters most......"
17105708,1,"TO THE DEAREST HEART.....??Who is this coming frm d desert,arm in arm with her lover??Under the apple tree i woke u,in d place where u were born.??Close your heart to every love but mine; hold no one in your arms but me.??Love is as powerful as death;?Passion is as strong as death itself.?It bursts into flame and burns like a raging fire.??Water cannot put it out;?No flood can drown it.?But if anyone tried to buy love with wealth,contempt is all they would get.??Like an apple tree among d trees of d forest,so is my dearest compared with other ladies.??I love to sit in her shadow and her fruit is sweet to my taste.He brought me to his banquetting hall and raised his banner of love over me.??You are like a dove that hides?In d crevice of a rock.?Let me see your lovely face?And hear your enchanting voice.??To the one that matters most......"
17105682,1,"http://ift.tt/1ndgWvA aePiot's http://ift.tt/LOqyB0 thanks aePiots Blog - http://ift.tt/1ndgWvA ... Follow aePiots - http://ift.tt/MzKgkE ... Like aePiots - http://ift.tt/1gZCrCE Smith Gambler Junior Series Goggles – Youth Smith Gambler Junior Series Goggles - Youth by Smith Optics… Lock Laces Elastic Shoelace and Fastening System Lock Laces Elastic Shoelace and Fastening System by Lock Laces… Concept2 Model D Indoor Rowing Machine Concept2 Model D Indoor Rowing Machine by Concept2 (442)Buy new:… Butler Creek LULA All-in-One Magazine Speed Loader and Unloader 223 Remington 5.56mm NATO Butler Creek LULA All-in-One Magazine Speed Loader and Unloader 223… Asus – 15.6″ Laptop – 4gb Memory – 500gb Hard Drive – Black Asus - 15.6"" Laptop - 4gb Memory - 500gb Hard… Gerber Graduates Kiddy Cutlery 3 Piece Fork Set Gerber Graduates Kiddy Cutlery 3 Piece Fork Set by Gerber… Danby DDW1899WP-1 Portable Dishwasher Danby DDW1899WP-1 Portable Dishwasher by Danby 623% Sales Rank in… Telescoping Extension Pole w/ Tripod Mount for GoPro Hero Cameras 9-37″ – by SANDMARC Telescoping Extension Pole w/ Tripod Mount for GoPro Hero Cameras… Whirlpool Part Number 2321800 Defrost BI-Metal Whirlpool Part Number 2321800: Defrost, BI-Metal by Whirlpool 1,017% Sales… Tasco Essentials 10x50Binocular Tasco Essentials 10x50Binocular by Bushnell 2,822% Sales Rank in Camera… Polaroid Sun 600 LMS Polaroid Sun 600 LMS by Polaroid 133% Sales Rank in… Carolina Carolina ~ Eric Church 207% Sales Rank in Music: 240… Igloo 3.2 Cu Ft Refrigerator – Black Igloo 3.2 Cu Ft Refrigerator - Black by Curtis 932%… My Funny Valentine My Funny Valentine ~ Miles Davis 29,589% Sales Rank in… Maytag Dryer Belt 31531589 Maytag Dryer Belt 31531589 by Maytag 738% Sales Rank in… Dell Latitude D610 Laptop CD-RW/ DVD Wireless Computer Refurbished Dell Latitude D610 Laptop CD-RW/ DVD Wireless Computer (Refurbished) by… Anonymous – 13″ Macbook Vinyl Decal Anonymous - 13"" Macbook Vinyl Decal by Yadda-Yadda Design Co.… GoPro Bag Pack GoPro Bag Pack by GoPro 197% Sales Rank in Camera… Samsung WF289 Refrigerator Water Filter Samsung WF289 Refrigerator Water Filter by Samsung 528% Sales Rank… Amaryllis Amaryllis Shinedown | Format: MP3 Music 301% Sales Rank in… Wish You Were Here 2011 - Remaster 2011 – Remaster Wish You Were Here [2011 - Remaster] (2011 - Remaster)… Digital Reins 10.1″ Inch Android 4.2 Tablet PC with Dual Camera and HDMI Digital Reins 10.1"" Inch Android 4.2 Tablet PC with Dual… Sistema 656 ml Soup Mug Sistema 656 ml Soup Mug by Sistema 97% Sales Rank… BABYBJORN Baby Carrier One Black BABYBJORN Baby Carrier, One, Black by BABYBJORN 142% Sales Rank… Whirlpool Part Number Y706012 FILTER Whirlpool Part Number Y706012: FILTER by Whirlpool 492% Sales Rank… HP Pavilion 14-n019nr 14-Inch Touchscreen Laptop Silver HP Pavilion 14-n019nr 14-Inch Touchscreen Laptop (Silver) by HP 84%… Alone yet Not Alone Alone yet Not Alone Joni Eareckson Tada | Format: MP3… Onyx Onyx Pop Evil | Format: MP3 Music 164% Sales Rank… SkyWorld SkyWorld Two Steps From Hell | Format: MP3 Music 172%… Kitchenaid KUDE70FXSS Superba Series EQ Dishwasher Kitchenaid KUDE70FXSS Superba Series EQ Dishwasher by KitchenAid 674% Sales… Cetaphil Restoraderm Skin Restoring Moisturizer 10-Fluid Ounces Cetaphil Restoraderm Skin Restoring Moisturizer, 10-Fluid Ounces by Cetaphil 396%… NEW Replacement Part – Dryer Drive Motor for Whirlpool Sears Kenmore Part# 8538262 NEW Replacement Part - Dryer Drive Motor for Whirlpool, Sears,… NUK Replacement Silicone Spout Clear NUK Replacement Silicone Spout, Clear by NUK 105% Sales Rank… Lamaze Cot Soother Logan the Lion Lamaze Cot Soother, Logan the Lion by TOMY 57,217% Sales… Haier HBCW100ABB 16-Bottle Wine Cellar and Beverage Center Haier HBCW100ABB 16-Bottle Wine Cellar and Beverage Center by Haier… BABYBJORN Soft Bib Pink and Green 2-Count BABYBJORN Soft Bib, Pink and Green, 2-Count by BABYBJORN 76%… 6 Pack Whirlpool Kenmore Maytag Roper Admiral Kitchenaid Estate Sears Dryer Thermal Fuse Part 3392519 3388651 694511 ET401 80005 (6 Pack) Whirlpool Kenmore Maytag Roper Admiral Kitchenaid Estate Sears… Greatest Hits Greatest Hits RUN-DMC | Format: MP3 Music 162% Sales Rank… Kind Of Blue Kind Of Blue Miles Davis | Format: MP3 Music 188%… # 1 Beatles Hits – The Best Of The Beatles Cover-Versions # 1 Beatles Hits - The Best Of The Beatles… Brita 35503 Pitcher Replacement Filters 3-Pack Brita 35503 Pitcher Replacement Filters, 3-Pack by Brita 200% Sales… Dove Men Care Body and Face Wash Clean Defense 13.5 Ounce Dove Men Care Body and Face Wash Clean Defense, 13.5… Cuisinart WMR-CA Round Classic Waffle Maker Cuisinart WMR-CA Round Classic Waffle Maker by Cuisinart 100% Sales… Sealy Soybean Foam-Core Crib Mattress Sealy Soybean Foam-Core Crib Mattress by Sealy 80% Sales Rank… The Complete Concert 1964 – My Funny Valentine Four & More The Complete Concert 1964 - My Funny Valentine + Four… Chief Digital Booklet Chief [+Digital Booklet] Eric Church | Format: MP3 Music 307%… Safety 1st Clear View Stove Knob Covers 5-Pack Safety 1st Clear View Stove Knob Covers 5-Pack by Dorel… Ilford 1574577 HP5 Plus Black and White Print Film 135 35 mm ISO 400 36 Exposures Ilford 1574577 HP5 Plus, Black and White Print Film, 135… Ilford 1629017 HP-5 Plus 400 Fast Black and White Professional Film ISO 400 120 Size Ilford 1629017 HP-5 Plus 400 Fast Black and White Professional… Dell Inspiron 15R i15RMT-10001sLV 15.6-Inch Touchscreen Laptop Moon Silver Dell Inspiron 15R i15RMT-10001sLV 15.6-Inch Touchscreen Laptop (Moon Silver) by… Waring Pro WMK600 Double Belgian-Waffle Maker Waring Pro WMK600 Double Belgian-Waffle Maker by Waring 281% Sales… Pyrex 6022369 Storage 14-Piece Round Set Clear with Blue Lids Pyrex 6022369 Storage 14-Piece Round Set, Clear with Blue Lids… Thermos Foogo Phases Leak Proof Stainless Steel Straw Bottle Blue Circles 10 Ounce Thermos Foogo Phases Leak Proof Stainless Steel Straw Bottle, Blue… Panasonic Lumix DMC-TS25 16.1 MP Tough Digital Camera with 8x Intelligent Zoom Red Panasonic Lumix DMC-TS25 16.1 MP Tough Digital Camera with 8x… Pwr® Rapid 2A Charger Ac Adapter for Acer Iconia Tablet A100 A200 A500 A501 W3 W3-810 Ak.018ap.027 Lc.adt0a.024 Gateway Tablet Tab Tp A60 Psa18r-120p Power Supply Cord Plug Charger Pwr+® Rapid 2A Charger Ac Adapter for Acer Iconia Tablet… Canon PowerShot SX510 HS 12.1 MP CMOS Digital Camera with 30x Optical Zoom and 1080p Full-HD Video Canon PowerShot SX510 HS 12.1 MP CMOS Digital Camera with… Dragon Touch R7 7” Google Android 4.1 Dual Core Tablet MID PC Rockchip RK3066 Dual Core Cortex A9 CPU up to 1.6GHz 1Gb RAM 8Gb HDD Multi-Touch Screen Front Camera Rear Camera Google Play Pre-Installed HDMI 1080P Output Skype Video Calling Netflix Flash Supported By TabletExpress 8GB Black Dragon Touch R7 7'' Google Android 4.1 Dual Core Tablet… Anker® High Performance 5200mAh/58Wh Laptop Battery for HP G32 G42 G42T G56 G62 G72 G4 G6 G6T G7 ; HP Presario CQ32 CQ42 CQ43 CQ430 CQ56 CQ62 CQ72 ; Envy 17 ; HP Pavilion DM4 DV3-4000 DV5-2000 DV6-3000 DV6-6000 DV7-4000 DV7-6000 Series; Fits MU06 593553-001 593554-001 MU09 WD548AA WD549AA WD548AA#ABB HSTNN-LB0W 636631-001 593550-001 -Upgraded With Higher Quality Samsung Cells yet has Same Size & Shape as an OEM Battery-18 Months Warranty Anker® High Performance 5200mAh/58Wh Laptop Battery for HP G32 G42… thanks http://ift.tt/1h2t0Cx aePiot February 10, 2014 at 07:27AM<br /><a href=""http://www.facebook.com/photo.php?fbid=816288538386115&set=gm.649499828430472&type=1&relevant_count=1""></a><br />"
17105659,1,"Psalm 59:6-16 New King James Version (NKJV)??Footnotes:??a. Psalm 59:9 Following Masoretic Text and Syriac; some Hebrew manuscripts, Septuagint, Targum, and Vulgate read my Strength. b. Psalm 59:10 Following Qere; some Hebrew manuscripts, Septuagint, and Vulgate read My God, His mercy; Kethib, some Hebrew manuscripts and Targum read O God, my mercy; Syriac reads O God, Your mercy. c. Psalm 59:15 Following Septuagint and Vulgate; Masoretic Text, Syriac, and Targum read spend the night.??Show Commentary??New King James Version (NKJV)??The Holy Bible, New King James Version Copyright © 1982 by Thomas Nelson, Inc.??^ Go to the top of the page??View more titles??Help and Contact FAQs/Tutorials Contact us/Feedback Why We Advertise Use Bible Gateway On Your Site Advertise with Us How to Support Bible Gateway Links Bible Gateway Store Mobile Bible Gateway ChurchSource Gospel.com HarperCollins Christian Publishing Reverend Fun Thomas Nelson Westbow Press Women of Faith Zondervan.com About and Legal Statement of Faith About Bible Gateway Press Releases Site map Privacy policy Your Ad Choices Site: Terms of use Widget: Terms of use??Home Passage Lookup Keyword Search Topical Index Available Versions Audio Bibles Additional Resources Reading Plans Devotionals Newsletters Bible Gateway App Preferences Bible Gateway Blog Store??Bible Gateway Recommendations??NKJV Precious Moments Holy Bible - Blue $17.99 $9.99 Save $8.00 (44%)??Buy now??NKJV Early Reader's Bible, Hardcover $19.99 $13.99 Save $6.00 (30%)??Buy now??The NKJV Explorer's Study Bible -Girls Purple Edition: Seeking God's Treasure and Living His Word $29.99 $19.99 Save $10.00 (33%)??Buy now??NKJV Personal Size Giant Print Reference Bible, Imitation Leather, dove gray $44.99 $19.99 Save $25.00 (56%)??Buy now??NKJV Large Print Personal Size Reference Bible, Black Bonded Leather, Thumb-Indexed $39.99 $23.99 Save $16.00 (40%)??Buy now??EnEspañol??Follow us??Psalm 59:6-16 New King James Versio??Search??Search??At evening they return, 6 They growl like a dog, And go all around the city. Indeed, they belch with their mouth;??7??Swords are in their lips; For they say, “Who hears?”??But You, O LORD, shall laugh at them;??8??You shall have all the nations in derision. I will wait for You, O You his Strength; [a] 9??For God is my defense. My God of mercy [b] shall come to meet me;??10??God shall let me see my desire on my enemies.??Do not slay them, lest my people forget;??11??Scatter them by Your power, And bring them down, O Lord our shield. For the sin of their mouth and the words of their lips,??12??Let them even be taken in their pride, And for the cursing and lying which they speak. Consume them in wrath, consume them,??13??That they may not be; And let them know that God rules in Jacob To the ends of the earth. Selah??And at evening they return,??14??They growl like a dog, And go all around the city. They wander up and down for food,??15??And howl [c] if they are not satisfied.??But I will sing of Your power;??16??Yes, I will sing aloud of Your mercy in the morning; For You have been my defense And refuge in the day of my trouble."
17107148,0,I love dove but got find the original one anywhere in the shops
