bid,spam,contents
17110468,1,"अगर सभी भारतीय 90 दिन तक ?कोई भी विदेशी सामान नहीं ख़रीदे...??तो भारत दुनिया का दूसरा सबसे ?अमीर देश बन सकता है..??सिर्फ 90 दिन में ही भारत के ?2 रुपये 1 डॉलर के बराबर हो जायेंगे..??हम सबको मिल कर ?ये कोशिश आजमानी चाहिए?क्युकी ये देश है हमारा..!!!!??plz share & aap bhi sahyog kare?Plz frwd this msg to all groups and say ?Is desh me rahena he to jag jao?In 1970 1$ = Rs. 4?Today 1$ = Rs. 68?Estimated 1$ by end of the year = Rs. 72??Dollar is not getting stronger, rupee is getting weaker! & nobody else is responsible for d fall, except us! ??How can we change it! ??1. A Cold Drink produced for 70-80 paisa sold at Rs. 9-10! ?Stop drinking them, Drink Lemon juice, Lassi, Fruit juice, butter milk etc. instead of coke, pepsi.??2. Use Soaps such as Cinthol, Santoor,Medimix, Neem, Godrej brands instead of lux,lifebuoy, rexona, liril, dove, pears, hamam,camay, palmolive!??3. Toothpaste-?Use Neem, babool, vicco, dabur instead of colgate,close up,pepsodent, cibaca??4. Toothbrush?Use prudent, ajanta,promise instead of colgate, close up, oral-b, pepsodent,forhans??5. Shaving cream- ?Use godrej, emami?Instead of palmolive,old spice, gillete.??6. Blade-?Use supermax, topaz, laser, ashoka?Instead of seven-o-clock, 365, gillete??7. Talcum powder-?Use santoor, gokul,cinthol, boroplus ?Instead of ponds, old spice, johnson,shower? to shower.??8. Milk powder?Use indiana, amul,amulya?Instead of anikspray,milkana, everyday milk, milkmaid? ?9. Shampoo- ?Use Nirma, Velvette?Instead of halo, all clear, sunsilk, head and shoulders, pantene??10. Mobile connections- ? Use bsnl, airtel,reliance,idea?Insteaf of vodafone??11. Food- ?Eat at jay bhavani, TGB, local restaurants ?Instead of mac-d, subway, pizza hut, kfc ??12. Mobile ?Use micromax, karbonn, lava?Instead of samsung,apple, htc, sony??13. Bikes-?Use hero, bajaj?Instead of honda, yamaha??14. Footwear-?Use paragon, chavda,lakhani?Instead of nike, reebok, adidas,converse? ?15. Jeans and shirts?Use spykar, k-lounge?Instead of lee, levi's,U.s. Polo, pepe, benetton? ?16. Watch ?Use titan, sonata ,fasttrack?Instead of tommy, Citizen, zodiac, tissot??Dont use products from hindustan lever, Only name is hindustan it has been taken by foreign company??We blame politicians ??Now go and check the things you use and ask yourself how much do you contribute to the decreased value of RUPEE??You use these foreign made products... & Government hv to pay in dollars for d same...thus value of rupee Decreases...?Aren't u responsible for fall of rupee..?Samsung S4 at Rs 41k.. Same features Micromax Can4 comes at Rs 17k..means u waste Rs 24k..and these 24k go to south Korea in dollars..??None of the indian products are subordinate in quality, they might look a bit less fancy!! ??Why is china so ahead, because the whole world uses made in china items.??We indians could atleast use made in india items! ??Change comes from within!  spread the change by broadcasting this msg to everyone on your contact list! ??I did my part, you do your and lets see by the end of this year does 1$ become Rs. 70 or it becomes Rs. 50..??JAAAAGO.?Some of these we follow....but we can make our best possible to make a change.??Please, before deleting, HELP your frnds by passing it..!??Let it reach d 121 crores Indians.??It might help sum1. Fwd to as many as u can. ??WhatsApp to free hai,, soo..frwrd it plz.."
17110236,1,"Scripture of the day:?1 Nephi 11:27-29? 27 And I looked and beheld the Redeemer of the world, of whom my father had spoken; and I also beheld the prophet who should prepare the way before him. And the Lamb of God went forth and was baptized of him; and after he was baptized, I beheld the heavens open, and the Holy Ghost come down out of heaven and abide upon him in the form of a dove.? 28 And I beheld that he went forth ministering unto the people, in power and great glory; and the multitudes were gathered together to hear him; and I beheld that they cast him out from among them.? 29 And I also beheld twelve others following him. And it came to pass that they were carried away in the Spirit from before my face, and I saw them not."
17110233,1,"Please read!?In 1970 1$ = Rs. 4?Today 1$ = Rs. 60.50?Estimated 1$ by end of the year = Rs. 70?Dollar is not getting stronger but rupee is?getting weaker & nobody else is?responsible except us!?How can we change it??1. A Cold Drink produced for 70-80 paisa?sold at Rs. 9-10!?Stop drinking them, go to soda shops &?drink lemon juice, lassi etc. instead of?coke, pepsi, limca?2. Soaps?Use Soaps of cinthol,santoor,medimix,?neem instead of lux,lifebuoy,re?xona,liril,dove,pears,hamam,le?sancy,camay,palmotive!?3. Toothpaste-?Use Neem, babool, vicco, dabur, promise?instead of colgate,close up,pepsodent,ci?baca?4. Toothbrush?Use prudent,ajanta,promise instead of?colgate, close up, oral-b,pepsoden?t,forhans?5. Shaving cream-?Use godrej ,emami, vjohn?Instead of palmotive,old spice,gillete.?6. Blade-?Use supermax,topaz,laser,ashoka?Instead of seven-o-clock,365,gillete?7. Talcum powder-?Use santoor,gokul,cinthol,boroplus?Instead of ponds,old spice,johnson,s?hower?to shower.?8. Milk powder?Use indiana,amul,amulya' verka?Instead of anikspray,milkana, everyday?milk, milkmaid?9. Shampoo-?Use Nirma, Velvette?Instead of halo, all clear,nyle sunsilk,head?and shoulders, pantene?10. Mobile connections-?Use bsnl,airtel,reliance?Insteaf of vodafone, docomo?11. Food-?Eat at jay bhavani, TGB, local restaurants?Instead of macdonld, subway, pizza hut,?kfc?12. Mobile?Use micromax, karbonn,virgin?Instead of samsung,apple, htc, sony,?nokia?13. Bikes-?Use hero, royal enfield?Instead of honda, yamaha?14. Footwear-?Use bata, chavda?Instead of nike, reebok,adidas,converse?15. Jeans and shirts?Use spykar, k-lounge?Instead of lee,levi's,U.s. Polo, pepe,?benetton?16. Watch?Use titan, sonata ,fasttrack?Instead of tommy, Citizen,zodiac,tissot?Don't use items from Hindustan Liver or?Uniliver. It is a foreign company.?And we blame politicians?Now go and check the things you use and?ask yourself how much do you contribute?to the decreased value of RUPEE?None of the indian products are?subordinate in quality, they might look a?bit less fancy!!?Why is china so ahead, because the whole?world uses made in china items.?We indians could atleast use made in?india items!?Change comes from within! Start the?change by simply changing your mobile?network and spread the change by?broadcasting this msg to everyone on?your contact list!?I did my part,?You do yours and let's see?by the end of this year?Does 1$ become Rs. 70?or it becomes Rs. 50."
17110231,1,"Kambal chapter 4??Hindi ako nakakibo sa tanong ni Claire. Nahalata nya ito. “Kuya, sa tingin mo kakayanin ko yung sa pwet? I wanna try it. Tignan mo, enjoy yung nasa movie.” “Nasubukan ko na iyan dati. Nag-experiment kami ng ex ko. Sa una medyo masakit. Pero siguro kung relaxed ka, sasarap din yan. Pero you’re too young to try that,” pakipot ko pang tugon. Pilit kong tinatago ang kasabikan ko sa ideya na titirahin ko ang bata kong pinsan sa pwet. ”I’m relaxed. Try natin kuya,pretty please. Curious lang talaga ako,” pa-cute na pagmamakaawa ni Claire. Kagyat nyang pinaghahalikan ang utong ko. Muli din nyang pinagapang ang malambot na kamay sa titi ko. Bumaba ang ulo nya. Shit, ilang saglit na naman ay isusubo na naman nya ang titi ko. Di na nga sya naghintay; hinalikan nya ang ulo at dali dali nya akong binlow job. Marunong na ang bata na gamitin ang laway upang lalo pang dumulas ang pagsubo sa akin. Kinapa ko mula sa likod nya ang kanyang puke. Basang basa pa din ito. ”Claire, ipatong mo ang puke mo sa mukha ko. 69 tayo,” utos ko. Nakapaghugas na pala ng puke si Claire. Wala nang bakas ng tamod ko na aking pinaputok kanila lang. Ang naiwan ay ang mabangong amoy ng kanyang sariwang puke. Amoy Dove soap. Pinunterya ko ang kanyang kuntil. Dinilaan ko muna ito upang magdulot ng kiliti sa bata. Napansin kong kusa nyang iginigiling ang balakang. Binigyan ko ng isang madiin na pagsipsip ang kanyang clit. ”Oh shit, oh shit. Ang saraaapp…” sigaw ng bata kong pinsan. Habang nilalaro ng dila ko ang puke ni Claire, nakita ko nang malapitan ang butas ng kanyang pwet. Napakaputi ng kutis at pinkish ang butas nito. Saradong sarado pa. Hindi ko alam kung paano ko pagkakasyahin ang titi ko sa makipot nyang tumbong. Bahala na. ”Claire, try ko lang ka.” Tinigil ko muna ang pagdila sa puke nya. Pinatalim ko ang dila ko at dinilaan ko ang butas ng kanyang pwet. Napakapit nang mahigpit si Claire sa titi ko. ”Ummm, ang sarap kuya…” May sampung minuto kong nilaro ng dila ang kanyang pwet, sabay masahe sa kanyang tinggel. Hindi na kinaya ni Claire na isubo ako ang titi ko sa sarap na nadarama. Binabate na lang nya ako. Di naglaon ay pinakawalan ni Claire ang isang masarap na panginginig ng katawan. Ramdam ko ang pag-agos ng masaganang hima mula sa puke nito. Hinayaan ko munang humiga si Claire upang lasapin ang sarap ng kanyang orgasmo. Tumayo ako, na may hinahanap sa kanyang mga toiletries. Agad kong nakita ang hinahanap ko. ”Natuyo pa ang labi mo kuya? Bakit mo kinuha yang petroleum jelly ko?” Natawa ako: ”May ibang ...» Next part"
17110230,1,"Today, February 10th, is the feast day of St. Scholastica, virgin. Scholastica and her twin brother, St. Benedict, established religious communities within a few miles from each other. ?Born in 480 of wealthy parents, Scholastica and Benedict were brought up together until he left central Italy for Rome to continue his studies. ??Little is known of Scholastica’s early life. She founded a religious community for women near Monte Cassino at Plombariola, five miles from where her brother governed a monastery. ??The twins visited each other once a year in a farmhouse because Scholastica was not permitted inside the monastery. They spent these times discussing spiritual matters. ??According to the Dialogues of St. Gregory the Great, the brother and sister spent their last day together in prayer and conversation. Scholastica sensed her death was close at hand and she begged Benedict to stay with her until the next day. ??He refused her request because he did not want to spend a night outside the monastery, thus breaking his own Rule. Scholastica asked God to let her brother remain and a severe thunderstorm broke out, preventing Benedict and his monks from returning to the abbey. ??Benedict cried out, “God forgive you, Sister. What have you done?” Scholastica replied, “I asked a favor of you and you refused. I asked it of God and he granted it.” ??Brother and sister parted the next morning after their long discussion. Three days later, Benedict was praying in his monastery and saw the soul of his sister rising heavenward in the form of a white dove. Benedict then announced the death of his sister to the monks and later buried her in the tomb he had prepared for himself.??ity."
17110229,1,"hello dears. it's been a while since i dove into the social part of being an artist... and i'll have you know I've been deep in work with many new songs... although that's not what I wanted this post to be about. what I want to share today is that one of my favorite talents and someone I'm lucky enough to call a dear friend will be touring Australia February 21 to March 9. If you have the chance, or the opportunity I suggest adding this into your calendar or at the very least adding her music to your life. ?https://www.facebook.com/events/711319515568316/"
17110228,1,"Morgens und abends zu lesen??Der, den ich liebe? hat mir gegagt? Daß er mich braucht.?? Darum? Gebe ich auf mich acht? sehe auf meinen Weg und? Fürchte von jedem Regentropfen? Daß er mich erschlagen Könnte ?(Bertolt Brecht)  ??Quello che amo? mi ha detto? che ha bisogno di me?? Per questo? ho cura di me stessa? guardo dove cammino e? temo che ogni goccia di pioggia? mi possa uccidere"
17109949,1,"February 10th, 2014 - Daily Bible Reading ??Matthew 10:1-20?English Standard Version (ESV)??1 And he called to him his twelve disciples and gave them authority over unclean spirits, to cast them out, and to heal every disease and every affliction. ?2 The names of the twelve apostles are these: ?first, Simon, who is called Peter, ?and Andrew his brother; ?James the son of Zebedee, ?and John his brother; ?3 Philip ?and Bartholomew; ?Thomas ?and Matthew the tax collector; ?James the son of Alphaeus, ?and Thaddaeus; ?4 Simon the Zealot, ?and Judas Iscariot, who betrayed him. ?5 These twelve Jesus sent out, instructing them, “Go nowhere among the Gentiles and enter no town of the Samaritans, ?6 but go rather to the lost sheep of the house of Israel. ?7 And proclaim as you go, saying, ‘The kingdom of heaven is at hand.’ ?8 Heal the sick, raise the dead, cleanse lepers, cast out demons. You received without paying; give without pay. ?9 Acquire no gold or silver or copper for your belts, ?10 no bag for your journey, or two tunics or sandals or a staff, for the laborer deserves his food. ?11 And whatever town or village you enter, find out who is worthy in it and stay there until you depart. ?12 As you enter the house, greet it. ?13 And if the house is worthy, let your peace come upon it, but if it is not worthy, let your peace return to you. ?14 And if anyone will not receive you or listen to your words, shake off the dust from your feet when you leave that house or town. ?15 Truly, I say to you, it will be more bearable on the day of judgment for the land of Sodom and Gomorrah than for that town. ?16 Behold, I am sending you out as sheep in the midst of wolves, so be wise as serpents and innocent as doves. ?17 Beware of men, for they will deliver you over to courts and flog you in their synagogues, ?18 and you will be dragged before governors and kings for my sake, to bear witness before them and the Gentiles. ?19 When they deliver you over, do not be anxious how you are to speak or what you are to say, for what you are to say will be given to you in that hour. ?20 For it is not you who speak, but the Spirit of your Father speaking through you."""
17109948,1,I CLEARLY saw one on tombigbee river years ago. It came up next to boat then dove down again.  I kept describing as fish with 'wings'.  Not till I saw on news years later did I know what it was
17109947,1,"2013 Landscape trailer. 20'x8 1/2' with 4' sides, pipe top rail,  2' dove tail,  for easier loading and a beefed up rear ramp tailgate. Trailer has 7000 lb axles with brakes, new 10 ply tires, bulldog hitch, lockable (3)weed eater rack, lockable gas can compartment, walk through side gate, spare tire rack and new spare, easily accessible storage box at front and  D-rings in all corners. $4950<br /><a href=""http://www.facebook.com/photo.php?fbid=10203277192320788&set=pcb.624519290935552&type=1&relevant_count=5""></a><br />"
