bid,spam,contents
68858504,1,"Handbags for sale, DKNY bag £45 ONO, DKNY purse £20 ONO. Black River Island bag £10 ONO, Burberry bag £45 ONO, Guess bag £45 ONO, Purse £20 ONO. White Next bag £15 ONO. I'm happy to send close up pics. I can deliver for the cost of petrol or collection from St Albans<br /><a href=""http://www.facebook.com/photo.php?fbid=10151940566031720&set=gm.790807460933581&type=1&relevant_count=1""></a><br />"
68858474,1,"Handbags for sale, DKNY bag £45 ONO, DKNY purse £20 ONO. Black River Island bag £10 ONO, Burberry bag £45 ONO, Guess bag £45 ONO, Purse £20 ONO. White Next bag £15 ONO. I'm happy to send close up pics. I can deliver for the cost of petrol or collection from St Albans<br /><a href=""http://www.facebook.com/photo.php?fbid=10151940563966720&set=gm.601937446548913&type=1&relevant_count=1""></a><br />"
68858473,1,"Handbags for sale, DKNY bag £45 ONO, DKNY purse £20 ONO. Black River Island bag £10 ONO, Burberry bag £45 ONO, Guess bag £45 ONO, Purse £20 ONO. White Next bag £15 ONO. I'm happy to send close up pics. I can deliver for the cost of petrol or collection from St Albans<br /><a href=""http://www.facebook.com/photo.php?fbid=10151940563696720&set=gm.617854644954515&type=1&relevant_count=1""></a><br />"
68858442,1,"Burberry \\'Colour Check\\' Square Scarf??#If you are searching for Burberry \\'Colour Check\\' Square Scarf, you are come to the right place. Today is your lucky day ! You can buy Burberry \\'Colour Check\\' Square Scarf for sale at low price now ! Shipping available within the USA. Best sellers Burberry \\'Colour Check\\' Square Scarf Check for low price Burberry \\'Colour Check\\' Square Scarf?If you are searching for Burberry \\'Colour Check\\' Square Scarf ?. I counsel you to acquire?I think its a great looking product with the price. ??CHECK TO SEE BEST DEAL CLICK THIS LINK BELOW??http://redirect.viglink.com/?key=cb8a09b9701b7b678fd3099fb8ec4831&out=http://shop.nordstrom.com/s/burberry-colour-check-square-scarf/3541738?origin=keywordsearch??Know that a fantastic internet store usually comes with various positive reviews and you might find virtually the many repayment gateways below . If you are yourself looking for a inexpensive Burberry \\'Colour Check\\' Square Scarf , always get it coming from an internet go on a spree that gives outstanding discount. Nowadays much of the online stores are offering to you discount price and that could be a easy for getting it a low-cost price.??Read More : http://redirect.viglink.com/?key=cb8a09b9701b7b678fd3099fb8ec4831&out=http://shop.nordstrom.com/s/burberry-colour-check-square-scarf/3541738?origin=keywordsearch??Some Tags : Christmas; best deals; Christmas; cheap; products; for customers; best Burberry \\'Colour Check\\' Square Scarf; offers; features; best buy; thanksgiving; uuue; reviews; specials; holiday; market price; christmas deals; shipping; top; holiday; special; bargain; best price; Sale 20%; Sale 30%; Sale 40%; Sale 50%; Sale 60%; Special Offer; Best Price; Best Offer; Special Price; Special Discount; Hot Price; Big Sale; Clearance Sale."
68858007,1,"Handbags for sale, DKNY bag £45 ONO, DKNY purse £20 ONO. Black River Island bag £10 ONO, Burberry bag £45 ONO, Guess bag £45 ONO, Purse £20 ONO. White Next bag £15 ONO. I'm happy to send close up pics. I can deliver for the cost of petrol or collection from St Albans<br /><a href=""http://www.facebook.com/photo.php?fbid=10151940558791720&set=gm.10152199325900050&type=1&relevant_count=1""></a><br />"
68857904,1,"Handbags for sale, DKNY bag £45 ONO, DKNY purse £20 ONO. Black River Island bag £10 ONO, Burberry bag £45 ONO, Guess bag £45 ONO, Purse £20 ONO. White Next bag £15 ONO. I'm happy to send close up pics. I can deliver for the cost of petrol or collection from St Albans<br /><a href=""http://www.facebook.com/photo.php?fbid=10151940553856720&set=gm.781237881889815&type=1&relevant_count=1""></a><br />"
68857902,1,"Amiraa Vee, Alexander Wang Showroom Assistant & Model, On The Perks Of Having Short Hair??While taking a break at Starbucks in between New York Fashion Week shows, we noticed this gorgeous short-haired gal. Amiraa Vee's piecey pixie haircut (and '90s dark lipstick) commanded our attention, much like the looks we've seen on the runways. And it definitely got us thinking about going short.??""I love my hair,"" said Vee. ""I'm known for doing all types of things with my hair, but lately I've been sticking to something short so I can just get up and go. Today, I tried this updo and I seem to be getting a lot of compliments."" Well-deserved compliments, we'd add.??Read More...More on Black Hairstyles?"
68857900,1,":( TJ's Hugo boss romper don't fit any more and he hasn't even worn it yet :( more money down the drain and alot of it, oh well that's life i guess xx"
68857396,1,"Lacoste slim tote bag?Horizontal??☆available color:?Springgreen?Limegreen?Armygreen?Mossgreen?Flame red?Violet?Cherry pink?Light violet?Navyblue ?Ashblue?Black?Inca gold (mustard)?Brown?Yellow?Orange??→ For inquiries please sms, viber 09395957812??https://www.facebook.com/media/set/?set=a.1387108761555043.1073741835.100007677968905&type=1&l=a66c491832"
68857395,1,"BURBERRY MEN?CODE : WIDR?COLOR : MAROON?Available sizes:?M 46 x 52 x 68?L 49 X 58 X 76??We specialised on importing designer brand apparels from Factory Reject Store.??Dear Customer,?Welcome to Branded Factory Outlet Store??All items are from different countries Official Reject Store and We've been filter away all the serious damage stock and remain better one for sale. Some items might contain very minor defects, while some are in perfect condition. Beside it is suitable for customers who are not so particular on authenticity.It's in lower price due to it's tax free basis and factory outlet basis.??How to Order??1. Provide me the code and size of item you wise to purchase. ( Web Link Acceptable )?2. Stock will be check in one working day.?3. After stock confirmation, please proceed the payment to us.?4. Delivery done in 3 working days.??Return/Exchange Policies:?Although all items are checked thoroughly for any defect/damage, but sometimes mistake might happened.?- Exchange is allowed for major defect.?- Cash refund is not allowed.?- All good(s) must be returned in original condition including tap, tag or packages.?- Upon receive the returned good(s), seller can exchange with the same designs and color provided the good(s) available. Else, the buyer can exchange with different designs and color. Prices difference should be top up to us.?- All good(s) are non-returnable / non-exchangeable as below :-?1. Minor loose threads, irregular fold or wrinkle produced by crumpling, color difference slightly from the photo(s) shown online.?2. Design is slightly different from the photo(s) shown (e.g. button, pocket, or tag).?3. Size measurement difference about 1-3cm only.??Measurement (cm) : Shoulder x Chest x Length??https://www.facebook.com/photo.php?fbid=610724272327547&set=a.610723555660952.1073742008.455021201231189&type=3&theater??Any enquiry please contact ↙↙?Facebook Page ↬ https://www.facebook.com/pages/Ladies-Choice-Boutique/455021201231189?(please help to click like) ｡◕‿◕。?Contact Number ↬ 012-5250739 ( Sms,,Whatapps,,Line,, & Call )?Or click the below link for inbox message ↙↙?https://www.facebook.com/messages/455021201231189<br /><a href=""http://www.facebook.com/photo.php?fbid=610724272327547&set=a.610723555660952.1073742008.455021201231189&type=1"">BURBERRY MEN</a><br />CODE : WIDR?COLOR : MAROON??Any enquiry please contact ↙↙?Facebook Page ↬ https://www.facebook.com/pages/Ladies-Choice-Boutique/455021201231189?(please help to click like) ｡◕‿◕。?Contact Number ↬ 012-5250739 ( Sms,,Whatapps,,Line,, & Call )?Or click the below link for inbox message ↙↙?https://www.facebook.com/messages/455021201231189 — with Yiu Kwong Chan and 18 others.<br />We specialised on importing designer brand apparels from Factory Reject Store.??Dear Customer,?Welcome to Branded Factory Outlet Store??All items are from different countries Official Reject Store and We've been filter away all the serious damage stock and remain better one for sale. Some items might contain very minor defects, while some are in perfect condition. Beside it is suitable for customers who are not so particular on authenticity.It's in lower price due to it's tax free basis and factory outlet basis.??How to Order??1. Provide me the code and size of item you wise to purchase. ( Web Link Acceptable )?2. Stock will be check in one working day.?3. After stock confirmation, please proceed the payment to us.?4. Delivery done in 3 working days.??Return/Exchange Policies:?Although all items are checked thoroughly for any defect/damage, but sometimes mistake might happened.?- Exchange is allowed for major defect.?- Cash refund is not allowed.?- All good(s) must be returned in original condition including tap, tag or packages.?- Upon receive the returned good(s), seller can exchange with the same designs and color provided the good(s) available. Else, the buyer can exchange with different designs and color. Prices difference should be top up to us.?- All good(s) are non-returnable / non-exchangeable as below :-?1. Minor loose threads, irregular fold or wrinkle produced by crumpling, color difference slightly from the photo(s) shown online.?2. Design is slightly different from the photo(s) shown (e.g. button, pocket, or tag).?3. Size measurement difference about 1-3cm only.??Measurement (cm) : Shoulder x Chest x Length??Any enquiry please contact ↙↙?Facebook Page ↬ https://www.facebook.com/pages/Ladies-Choice-Boutique/455021201231189?(please help to click like) ｡◕‿◕。?Contact Number ↬ 012-5250739 ( Sms,,Whatapps,,Line,, & Call )?Or click the below link for inbox message ↙↙?https://www.facebook.com/messages/455021201231189"
68857392,1,"adidas high tops for sale?need gone asap?£20 ?size 7<br /><a href=""http://www.facebook.com/photo.php?fbid=10200583942761104&set=gm.735502669807859&type=1&relevant_count=1""></a><br />"
68857391,1,"AN ACTUAL CRAIG'S LIST PERSONALS AD??To the Guy Who Tried to Mug Me in Downtown  night before last.??Date: 2011-11-27, 1:43 am. E.S.T.??I was the guy wearing the black Burberry jacket that you demanded that I hand over, shortly after you pulled?the knife on me and my girlfriend, threatening our lives. You also asked for my girlfriend's purse and earrings. I can only hope that you somehow come across this rather important message.??First, I'd like to apologize for your embarrassment; I didn't expect you to actually crap in your pants when?I drew my pistol after you took my jacket.. The evening was not that cold, and I was wearing the jacket for a reason.. my girlfriend was happy that I just returned safely from my 2nd tour as a Combat Marine in Afghanistan .. She had just bought me that Kimber?Custom Model 1911 .45 ACP pistol for my birthday, and we had picked up a shoulder holster for it that very evening. Obviously you agree that it is a very intimidating weapon when pointed at your head ... isn't it?!??I know it probably wasn't fun walking back to wherever you'd come from with crap in your pants. I'm sure it?was even worse walking bare-footed since I made you leave your shoes, cell phone, and wallet with me. (That prevented you from calling or running to your buddies to come help mug us again).??After I called your mother or ""Momma"" as you had her listed in your cell, I explained the entire episode of?what you'd done. Then I went and filled up my gas tank as well as those of four other people in the gas station, -- on your credit card. The guy with the big motor home took 153 gallons and was extremely grateful!??I gave your shoes to a homeless guy outside Vinnie Van Go Go's, along with all the cash in your wallet. [That?made his day!]??I then threw your wallet into the big pink ""pimp mobile"" that was parked at the curb ..... after I broke the?windshield and side window and keyed the entire driver's side of the car.??Earlier, I managed to get in two threatening phone calls to the DA's office and one to the FBI, while mentioning?President Obama as my possible target.??The FBI guy seemed really intense and we had a nice long chat (I guess while he traced your number etc.).?? In a way, perhaps I should apologize for not killing you ... but I feel this type of retribution?is a far more appropriate punishment for your threatened crime. I wish you well as you try to sort through some of these rather immediate pressing issues, and can only hope that you have the opportunity to reflect upon, and perhaps reconsider, the career path?you've chosen to pursue in life.. Remember, next time you might not be so lucky. Have a good day!??Thoughtfully yours, Semper fi,??Alex"
68857283,0,"Attention: In 2 weeks I will be selling and giving away all my son clothes from 18mos-2T summer wear. From Ralph Lauren, Lacoste, Buffalo jeans and more either holding a raffle via Facebook or selling pieces separate to those interested on a first come first serve bares. I also will put together a special bag for someone in need. If you know someone in need please let me know!"
68857212,1,"AN ACTUAL CRAIG'S LIST PERSONALS AD??To the Guy Who Tried to Mug Me in Downtown  night before last.??Date: 2011-11-27, 1:43 am. E.S.T.??I was the guy wearing the black Burberry jacket that you demanded that I hand over, shortly after you pulled?the knife on me and my girlfriend, threatening our lives. You also asked for my girlfriend's purse and earrings. I can only hope that you somehow come across this rather important message.??First, I'd like to apologize for your embarrassment; I didn't expect you to actually crap in your pants when?I drew my pistol after you took my jacket.. The evening was not that cold, and I was wearing the jacket for a reason.. my girlfriend was happy that I just returned safely from my 2nd tour as a Combat Marine in Afghanistan .. She had just bought me that Kimber?Custom Model 1911 .45 ACP pistol for my birthday, and we had picked up a shoulder holster for it that very evening. Obviously you agree that it is a very intimidating weapon when pointed at your head ... isn't it?!??I know it probably wasn't fun walking back to wherever you'd come from with crap in your pants. I'm sure it?was even worse walking bare-footed since I made you leave your shoes, cell phone, and wallet with me. (That prevented you from calling or running to your buddies to come help mug us again).??After I called your mother or ""Momma"" as you had her listed in your cell, I explained the entire episode of?what you'd done. Then I went and filled up my gas tank as well as those of four other people in the gas station, -- on your credit card. The guy with the big motor home took 153 gallons and was extremely grateful!??I gave your shoes to a homeless guy outside Vinnie Van Go Go's, along with all the cash in your wallet. [That?made his day!]??I then threw your wallet into the big pink ""pimp mobile"" that was parked at the curb ..... after I broke the?windshield and side window and keyed the entire driver's side of the car.??Earlier, I managed to get in two threatening phone calls to the DA's office and one to the FBI, while mentioning?President Obama as my possible target.??The FBI guy seemed really intense and we had a nice long chat (I guess while he traced your number etc.).?? In a way, perhaps I should apologize for not killing you ... but I feel this type of retribution?is a far more appropriate punishment for your threatened crime. I wish you well as you try to sort through some of these rather immediate pressing issues, and can only hope that you have the opportunity to reflect upon, and perhaps reconsider, the career path?you've chosen to pursue in life.. Remember, next time you might not be so lucky. Have a good day!??Thoughtfully yours, Semper fi,??Alex"
68857211,1,"This is felicity. Her mommy was Emily. A good friend of Jessica LaCoste Jurisch. Emily passed away yesterday. Please pray for felicitys healing after being born 2 months early.<br /><a href=""http://www.facebook.com/photo.php?fbid=10202272696792606&set=a.1454119546759.2055746.1046403379&type=1"">Mobile Uploads</a><br />Felicity is doing well. She has been weaned off the vent and onto a CPAP. Vitals are good and she is active."
68857207,1,"Burberry \\'Leila\\' Flat (Walker??#If you are searching for Burberry \\'Leila\\' Flat (Walker, you are come to the right place. Today is your lucky day ! You can buy Burberry \\'Leila\\' Flat (Walker for sale at low price now ! Shipping available within the USA. Best sellers Burberry \\'Leila\\' Flat (Walker Check for low price Burberry \\'Leila\\' Flat (Walker?If you are searching for Burberry \\'Leila\\' Flat (Walker ?. I counsel you to acquire?I think its a great looking product with the price. ??CHECK TO SEE BEST DEAL CLICK THIS LINK BELOW??http://redirect.viglink.com/?key=cb8a09b9701b7b678fd3099fb8ec4831&out=http://shop.nordstrom.com/S/burberry-leila-flat-walker-toddler-little-kid-big-kid/3466899?origin=keywordsearch??Know that a fantastic internet store usually comes with various positive reviews and you might find virtually the many repayment gateways below . If you are yourself looking for a inexpensive Burberry \\'Leila\\' Flat (Walker , always get it coming from an internet go on a spree that gives outstanding discount. Nowadays much of the online stores are offering to you discount price and that could be a easy for getting it a low-cost price.??Some Tags : Christmas; best deals; Christmas; cheap; products; for customers; best Burberry \\'Leila\\' Flat (Walker; offers; features; best buy; thanksgiving; uuue; reviews; specials; holiday; market price; christmas deals; shipping; top; holiday; special; bargain; best price; Sale 20%; Sale 30%; Sale 40%; Sale 50%; Sale 60%; Special Offer; Best Price; Best Offer; Special Price; Special Discount; Hot Price; Big Sale; Clearance Sale."
68856916,1,"Burberry \\'Bloomhall\\' Sandal??#If you are searching for Burberry \\'Bloomhall\\' Sandal, you are come to the right place. Today is your lucky day ! You can buy Burberry \\'Bloomhall\\' Sandal for sale at low price now ! Shipping available within the USA. Best sellers Burberry \\'Bloomhall\\' Sandal Check for low price Burberry \\'Bloomhall\\' Sandal?If you are searching for Burberry \\'Bloomhall\\' Sandal ?. I counsel you to acquire?I think its a great looking product with the price. ??CHECK TO SEE BEST DEAL CLICK THIS LINK BELOW??http://redirect.viglink.com/?key=cb8a09b9701b7b678fd3099fb8ec4831&out=http://shop.nordstrom.com/S/burberry-bloomhall-sandal/3478781?origin=keywordsearch??Know that a fantastic internet store usually comes with various positive reviews and you might find virtually the many repayment gateways below . If you are yourself looking for a inexpensive Burberry \\'Bloomhall\\' Sandal , always get it coming from an internet go on a spree that gives outstanding discount. Nowadays much of the online stores are offering to you discount price and that could be a easy for getting it a low-cost price.??Some Tags : Christmas; best deals; Christmas; cheap; products; for customers; best Burberry \\'Bloomhall\\' Sandal; offers; features; best buy; thanksgiving; uuue; reviews; specials; holiday; market price; christmas deals; shipping; top; holiday; special; bargain; best price; Sale 20%; Sale 30%; Sale 40%; Sale 50%; Sale 60%; Special Offer; Best Price; Best Offer; Special Price; Special Discount; Hot Price; Big Sale; Clearance Sale."
68856915,1,"Burberry Money Clip Wallet?Price : Rs 1999/- Only?To Order Please Call/Whatsapp @ +91-9266621712?Thanks<br /><a href=""http://www.facebook.com/photo.php?fbid=10152607008434689&set=pcb.10152607013429689&type=1&relevant_count=2""></a><br />"
68856913,1,"Lacoste slim tote bag?Horizontal??☆available color:?Springgreen?Limegreen?Armygreen?Mossgreen?Flame red?Violet?Cherry pink?Light violet?Navyblue ?Ashblue?Black?Inca gold (mustard)?Brown?Yellow?Orange??→ For inquiries please sms, viber 09395957812??https://www.facebook.com/media/set/?set=a.1387108761555043.1073741835.100007677968905&type=1&l=a66c491832"
68856912,1,"Lacoste \\'Marcel\\' Sneaker (Toddler & Little Kid)??#If you are searching for Lacoste \\'Marcel\\' Sneaker (Toddler & Little Kid), you are come to the right place. Today is your lucky day ! You can buy Lacoste \\'Marcel\\' Sneaker (Toddler & Little Kid) for sale at low price now ! Shipping available within the USA. Best sellers Lacoste \\'Marcel\\' Sneaker (Toddler & Little Kid) Check for low price Lacoste \\'Marcel\\' Sneaker (Toddler & Little Kid)?If you are searching for Lacoste \\'Marcel\\' Sneaker (Toddler & Little Kid) ?. I counsel you to acquire?I think its a great looking product with the price. ??CHECK TO SEE BEST DEAL CLICK THIS LINK BELOW??http://redirect.viglink.com/?key=cb8a09b9701b7b678fd3099fb8ec4831&out=http://shop.nordstrom.com/S/lacoste-marcel-sneaker-toddler-little-kid/3521680?origin=keywordsearch??Know that a fantastic internet store usually comes with various positive reviews and you might find virtually the many repayment gateways below . If you are yourself looking for a inexpensive Lacoste \\'Marcel\\' Sneaker (Toddler & Little Kid) , always get it coming from an internet go on a spree that gives outstanding discount. Nowadays much of the online stores are offering to you discount price and that could be a easy for getting it a low-cost price.??Some Tags : Christmas; best deals; Christmas; cheap; products; for customers; best Lacoste \\'Marcel\\' Sneaker (Toddler & Little Kid); offers; features; best buy; thanksgiving; uuue; reviews; specials; holiday; market price; christmas deals; shipping; top; holiday; special; bargain; best price; Sale 20%; Sale 30%; Sale 40%; Sale 50%; Sale 60%; Special Offer; Best Price; Best Offer; Special Price; Special Discount; Hot Price; Big Sale; Clearance Sale."
68856911,1,"Burberry \\'Colour Check\\' Square Scarf??#If you are searching for Burberry \\'Colour Check\\' Square Scarf, you are come to the right place. Today is your lucky day ! You can buy Burberry \\'Colour Check\\' Square Scarf for sale at low price now ! Shipping available within the USA. Best sellers Burberry \\'Colour Check\\' Square Scarf Check for low price Burberry \\'Colour Check\\' Square Scarf?If you are searching for Burberry \\'Colour Check\\' Square Scarf ?. I counsel you to acquire?I think its a great looking product with the price. ??CHECK TO SEE BEST DEAL CLICK THIS LINK BELOW??http://redirect.viglink.com/?key=cb8a09b9701b7b678fd3099fb8ec4831&out=http://shop.nordstrom.com/s/burberry-colour-check-square-scarf/3541738?origin=keywordsearch??Know that a fantastic internet store usually comes with various positive reviews and you might find virtually the many repayment gateways below . If you are yourself looking for a inexpensive Burberry \\'Colour Check\\' Square Scarf , always get it coming from an internet go on a spree that gives outstanding discount. Nowadays much of the online stores are offering to you discount price and that could be a easy for getting it a low-cost price.??Read More : http://redirect.viglink.com/?key=cb8a09b9701b7b678fd3099fb8ec4831&out=http://shop.nordstrom.com/s/burberry-colour-check-square-scarf/3541738?origin=keywordsearch??Some Tags : Christmas; best deals; Christmas; cheap; products; for customers; best Burberry \\'Colour Check\\' Square Scarf; offers; features; best buy; thanksgiving; uuue; reviews; specials; holiday; market price; christmas deals; shipping; top; holiday; special; bargain; best price; Sale 20%; Sale 30%; Sale 40%; Sale 50%; Sale 60%; Special Offer; Best Price; Best Offer; Special Price; Special Discount; Hot Price; Big Sale; Clearance Sale."
68856770,1,"$50 12 garbage bags full of men's clothing and women's clothing. Brands include: roots, Levi, Aeropostale, old navy, guess, dress pants from moores, tommy hilfilger, garage, le chateau, etc. most are relatively new. Men's size medium for all shirts, pants size 34. Women's size small, pants size 0-2. 15 art pieces of wall art (Chinese paintings), sail boat paintings, huge pictures of flowers and such (decor pieces for home), tea cups, coffee machine (yes, it works!) needs to be picked up ASAP. This is OBVIOUSLY more than a steal of a deal. You would seriously need to bring a van, SUV, or truck to till it all. And a partner to help you out. Pm me only. Oh and also leather shoes Nike Adidas dress shoes"
68856469,1,"15 minutes to go two blocks getting to the Brooklyn Navy yard for Alexander Wang. Inconsiderate planning, sniffed a fashion writer on Twitter."
68856468,1,"BIG SALE ..Numpang jualan ya Minsay... jual MURMER 150rb aja .Tas burberry kotak  ada tali panjang .. kwalitas kw super.....kondisi baru/new..tanpa minuss...pengiriman dari solo..maaf No Freeong ya..monggo yang mau coret2 bertanya ..dan yang serius order langsung sms/wa 082226541390..biar gak kehabisan Θαπ NO BOOKED.Grab it fast..terima kasih...<br /><a href=""http://www.facebook.com/photo.php?fbid=10200635940740304&set=gm.429936773805539&type=1&relevant_count=1""></a><br />"
68856429,1,"並不是穿上 levi's  Edwin camper JD 背 LV Cucci  Chanel  BURBERRY 戴 ck Ancon Luminox Rolex 手上有金戒指鑽戒脖子上有金項鍊寶石項鍊,就覺得是流行是高貴?而是人品問題,人品在差穿什麼也一樣低俗 ......<br /><a href=""http://www.facebook.com/photo.php?fbid=655901154469617&set=a.544251125634621.1073741828.544241848968882&type=1"">生活時報相片</a><br />某些人對於流行的定義"
